KEYWORD,SCORE
include high voltage high current distribution cabling indoor outdoor enclosure rack thermal management component magnetics fuse breaker communication data interface emi shielding,348.8474358974359
production maintenance plant quality manufacturing electric electronics mechanical process power tool die supply dispatch assembly machine welding material fabrication supervision control technical,174.08602266038434
condensate feed water main steam hot reheat cold reheat extraction steam heater drains vents,168.20833333333331
mechanical engineer mechatronics purchase engineer marketing engineer mechanical engineering research engineer purchase manager marketing manager research manager senior engineer senior mechanical,158.07382125000584
main plant equipment boiler steam turbine gas turbines feed pumps condensate pumps heaters condenser,141.8564814814815
electricals mechanical engineering erection personal skills interpersonal skills problem solvingcement erectionmechanical engineersolving engineersolving mechanicalcustomer management,138.43820526069732
industry material handling conveyors sp ms packaging machines pharmaceutical machine machine tool industrial automation,100.37157874406797
tech mechanical civil elec chemical bio tech architectural plastic oil gas automobile work closely,100.25721690590112
safety project planning project execution environment maintenance operations project costing project documentation vendor management conflict resolution manpower management,96.94434931506848
design calculations tema ansip design engineering mechanical design equipment design design development tema asme project planning,93.58420911166522
machineries equipments tools cranes tower mobile automatic concrete ready mix,90.16666666666667
mechanical data sheet material requisition technical evaluation purchase requisition vendor document review,87.27630279968213
maintenance mechanical testingmaterials engineermechanical software testing automotive electronics production engineeringmechanical engineer automobile,85.47680726780158
control description technical specifications bid evaluations vendor drawing reviews general arrangement drawings,84.65502911690993
vacuum pumps breakdown maintenance blowers pneumatics preventive crusher mechanical maintenance extruder maintenance activities,84.3477143460561
ja cstatic engineerstatic design engineerstatic mechanicalpressure vessel engineerstatic senior engineer,83.16989327780308
pension scheme ltc group linked insurance scheme children education allowances,81.85714285714286
machinery standard ansi nec cec csa eia en etsi nebs,80.88888888888889
shift fire alarm etp stp blower hvac utility maintenance dg sets,80.33639476961395
pump compressor turbine material handling equipment agitator mixer ic engine,73.95669270418195
pump compressor steam generation boiler water waste water plant,65.5138888888889
pumps compressorsmechnical maintenanceutility maintenance hvacahu cooling towers utility equipments,63.733616991836165
auto cad solid edge2d design3d mechanical engineeringcreoproetolerance analysismechanical design,58.13379415629726
industry material handling conveyors fork lift manufacturing industrial automation,56.99835937084861
mechanical ventilation system fire protection system water system pump,56.51656034024455
cad cam manufacturing process export house mechanical engineeringmechanical manufacturinghardgoods,55.820302893987105
conveyor sp ms automation system assembly automation pick,55.371212121212125
tube type heat exchanger storage tank filter manually,54.2
conceptual design design calculation detailed design layout drawing preparing drawing,52.196374993566984
job title mechanical design engineer forklift pallet truck design,51.14136795281535
waste water treatmenteffluent treatmentsewage treatmentetpwtpstpwaste wtpwaste etp,50.041666666666664
refinery expansion fertilizer petrochemical plant oil gas project,47.607142857142854
instrument air package nitrogen package water treatment boiler,43.482142857142854
weldment assembly hydraulic routing concept design industrial compressors,43.332152230971126
fabrication technology sheet metal forming machining injection molding,43.31944444444444
supervises technical supervisors electricians hvac technicians fitters,43.05
vacuum pumps root blowers rotary feeder,42.72222222222222
part drawing qualified part list schematic ec ns,42.199643493761144
conveyor fork lift mechanism pallet truck,42.16666666666667
pc laptop mobile tablet mechanical design review,40.29618731869043
chillers pumps cooling towers compressors ah,39.605555555555554
design innovative material handling solution including component selection,38.83990313621127
technical reports writing feasibility studies dp rs,38.55
design customer support solid works mechanical engineering technical sales,37.97253140471194
developing mechanical control system injection system heating system,37.8048644338118
fire safety standard autocad powerpoint excel word,37.69354256854257
project management understands project life cycle scheduling,36.96984126984127
performs complex calculation stress analysis thermal analysis,36.675595238095234
engineer mechanical maintenance plastic industry west bengal,36.56140322739752
indira bridge gandhinagar highway bhat gandhinagar 382 428,36.0
energetic fast paced multi disciplinary team environment,35.83168498168498
mechanical maintenance traineediploma trainee engineer diploma fresher engineer,35.52969982978504
id pfd equipment ga layout drawing input,35.49324618736384
job title mechanical design engineer industrial automation,35.275882388510894
contributory health service scheme chss perquisite,34.75
eb tech mechanicalelectricalmaintenance mechanical testing cad pro,34.59608636977058
mechanical drawing shop drawing working drawing detail drawing,34.31109391124871
good analytical problem solving skill involving electrical automation,34.20496894409938
surface miners feeder breaker crushers,33.83333333333333
inspection instruments vernier caliper micro meter,33.8
assitt engineer mechanical maintenance auto component manufacturing,33.75121804221234
casting plastic sheet metal rubber hoses,33.486111111111114
3d cad design software solid works preferred mandatory,32.58920351302241
sheet metal press tool machine maintenance,32.5869775201967
electrical electronic circuit functionality reading schematic,30.75
work location ambattur poonamallee oragadam irrungattukottai,30.333333333333332
perform verification testing support compliance certification effort,30.211764705882356
maintenance engineering mechanical maintenance maintenance plant engineering,30.078937871634455
reliability improvement design activity multiple sourcing exercise,29.95028948587309
activities include calculations preparation,29.95
api iso din en manufacturer standard,29.72222222222222
civil electrical automobile mechanical desigen engineer 99584152,29.63662461939974
air conditioning power generation transportation processing,29.348484848484848
product engineer opto mechanical assembly testing 1 opening,29.001776134551253
engineer sr engineer purchase mechanical,28.98951718138321
work resolving cost issue packaging manufacturing,28.945370370370366
material selection costing making design proposal,28.83906280007682
provide maximum output level efficient running,28.816666666666666
water treatment system etp wwtp,28.579545454545453
automatic samplers sample transport lab equipment,28.314814814814813
knowledge plate type heat exchanger design,28.3039913114309
industrial pump water treatment system,28.051767676767675
electro mechanical design applies innovative technology,27.89063176313487
high rise residential commercial township,27.833333333333336
design deliverable conduct pre bid meeting,27.323818897637796
conducting research program applying principle,27.166666666666668
batching plant stone quarry crusher,27.125
asme ansi tema standard,27.055555555555557
lift wtp stp fire plumbing,26.925
design basis report drawings preparation checking,26.337707786526686
mechanical design engineer electro mechanical design,26.313449017546144
vendor development activity supplier audit developing,26.247303921568626
auto mechanic mechanical engineer east africa,26.240665023440144
main plant system engineering expertise,26.20588954056696
handling multiple diverse short term project,26.19766573295985
mechanical lead engineer reviewer bop mps,26.13510946788459
hand dirty building prototype performing wire,26.0
skills required manufacturing production quality maintenance,25.922091480310662
skills autocad design engineer solidworks engineer,25.59334861034933
surface miners feeder breakers crushers,25.333333333333332
tendering technical bid evaluation recommendation,25.192857142857143
mechanical engineer shift engineer mechanical maintenance,25.143734917504336
wanted qualified mechanical piping engineers degree,24.967026540710748
concept design product design detail design,24.563123359580054
international recruitment company providing job opportunity,24.500287356321838
engineer mechanical maintenance machine shop,24.113753654747953
engineer mechanical maintenance indian mnc cochin,23.825292116286413
prepare design layout ga layout,23.771895820714718
outgoing 2d 3d drawing model,23.703431372549023
lead mechanical engineer mining equipment design,23.565409847003867
sheetmetal auto desk inventor sheetmetal,23.555555555555554
processing machine good interpersonal skill,23.395604395604394
gas turbine mechanical system,23.024136097820307
selecting pump water tank,22.930555555555557
mechanical cadd engineer educadd pune,22.81844280121792
orthopedic mechanical design engineer hyderabad,22.76726169885572
senior reliability engineer mechanical qatar,22.69344280121792
hydraulic system design component selection,22.553364352183248
detailed engg vendor drawing review,22.48815359477124
maintenance job including civil maintenance,22.438985986458825
characterization competitive product assessment evaluation,22.29285714285714
mechanical engineers maintenance industrial engineer,22.13084767184197
industry industrial products heavy machinery,22.125
fabrication raw material cutting profile,22.056910569105693
required design calculation stress calculation,21.90715223097113
water pumping distribution,21.875
experience holder hard worker honest,21.848101265822784
process workflow drawing manufacturing procedure,21.76931456343221
ac dc power system experience,21.73446490218642
mechanical engineering technicians mechanical engineers,21.626636483682322
equipment ga layout drawing study,21.493246187363837
mechanic thermodynamics hydraulics heat transfer,21.4
position senior reliability engineer mechanical,21.39344280121792
role category production manufacturing maintenance,21.27721968543886
mechanical design engineer direct walkin,21.267261698855716
job title shift engineer mechanical,21.243730157539762
electronics manufacturing industry,21.162037037037038
material engineering change order eco,21.099921321793865
production documentation including bom assembly,21.055555555555557
suggest alternate cost effective design,20.948818897637796
product related field issue cost reduction,20.905952380952378
awarding stage anf detailed scope,20.88888888888889
undertaking manpower planning work allocation,20.883333333333333
functional area production manufacturing maintenance,20.84150539972458
multidisplinary interface knowledge coordination,20.780172413793103
senior mechanical engineer hvac,20.31844280121792
mechanical automobile aeronautical engineers required,20.304439128123338
gas turbine compressor,20.22222222222222
acceptable discipline gate 2015 qualified candidate,20.121794871794872
structural component hydraulic circuit design,20.098818897637795
senior mechanical engineer female,20.06844280121792
conflict resolution,20.0
balance plant system engineering knowledge,19.861061954360064
display panel equipment testing implementation,19.814814814814813
software autocad catia hypermesh pro,19.785714285714285
electrical boq preparation cost estimation,19.7
senior reliability engineer mechanical,19.69344280121792
defining product launch project plan,19.642063492063492
supervising amc vendor including requirement,19.642045454545453
mechanical refrigeration boiler utilities,19.597368421052632
process engineer mechanical api industry,19.597288955064073
role senior design engineer,19.569893277803082
asme tema api,19.5
water treatment equipment plant,19.48148148148148
mechanical engineer fire fighting,19.44344280121792
wanted graduate mechanical piping engineers,19.402923976608186
vacuum pumps servicing,19.38888888888889
supervisory experience covering maintenance installation,19.354950580891277
handling multi party vendor,19.316911764705882
developing material handling solution,19.29108423857348
lead engineer mechanical rotating packages,19.010109467884586
good inter personal skill,18.857142857142858
master project stage serial production,18.8015873015873
design calculation material selection,18.77656280007682
autodesk inventor sheet metal,18.708333333333332
ad merkblatter bs en,18.666666666666668
crusher pneumatic conveying system,18.637878787878787
supervision man power planning,18.59848484848485
handling air cooler ejector,18.529411764705884
comprise power system solution,18.45779220779221
industrial instrumentation production manufacturing,18.453703703703702
attend preventive breakdown maintenance activity,18.440895660879544
gas energy power infrastructure,18.4040404040404
equipments required inspection 33 66 132 kv,18.383333333333333
duty time food transportation cab,18.366666666666667
asme y14 5m standard,18.305555555555557
solid works cad software,18.282051282051285
mechanical equipment required installation maintenance,18.252365884269274
project engineers mechanical chemical,18.20451127819549
salary tax free company benefits,18.125
manufacturing assembly dfma principle,18.037037037037035
moradabad based export house,18.0
leading oil gas companies,17.84722222222222
production mechanical automobile engineer,17.803291286066404
3d model assembly detailing,17.791666666666668
orthopedic mechanical design engineer,17.76726169885572
good analytical problem solving skill,17.704968944099377
thermal dissipation calculation,17.6875
vendor development solving technical,17.654166666666665
reputed machine manufacturing company,17.617165242165242
similar project ha good experience,17.590164757886278
allowance medical scheme facility,17.583333333333336
control piping civil electrical,17.54385964912281
electro mechanical design engineer,17.51726169885572
fabrication bill checking work planning,17.5
checking compliance related mining standard,17.486507936507934
opto mechanical production line,17.4140350877193
supervising mechanical installation operation maintenance,17.39967228157567
food industry job involves traveling,17.383620689655174
heat treatment furnace area,17.28333333333333
mechanical design engineer hydraulic,17.167261698855715
pressure vessel column shell,17.0
cad tool preferably inventor,16.915384615384614
supervision small office environment,16.904761904761905
mechanical engineer 1 2 yrs ranchi,16.81844280121792
mechanical engineer contractual opportunity,16.81844280121792
control system hydraulic electrical,16.815071770334928
perform system level calculation,16.80381016042781
document job career html,16.758620689655174
purchase sourcing,16.7
apply online http ww ipr,16.69047619047619
production quality mechanical engineering,16.6852509686126
multi disciplinary team strong understanding,16.53803418803419
online registration 24th july 2015,16.5
pig launcher receiver design,16.448818897637796
high level proficiency,16.416666666666668
large manufacturing engineering unit,16.413381123058542
material handling equipment independently,16.40113714862639
designing material handling equipment,16.15113714862639
job responsibilities mechanical engineering expert,16.125190339586453
senior mechanical engineer,16.06844280121792
role category engineering design,16.058496316992635
fresh mechanical engineering graduates,16.05704584040747
manufacturing engineering design activity,16.038670608931632
pioneer management consultants hiring,16.03333333333333
oil gas power,16.0290404040404
sez eou stpi e1,16.0
netbrains consulting solutions pvt,16.0
plant mechanical maint engg,15.972368421052632
machine maintenance repair preferably,15.936219944439124
multi disciplinary design coordination,15.923818897637794
plant water system,15.871212121212121
industrial manufacturing environment,15.858465608465607
pump compressor gearbox,15.805555555555555
static equipment related piping code,15.77910052910053
preparing proto type sample,15.733333333333334
excellent supplier relationship management,15.7
automotive telecommunication power,15.681818181818182
technical business research,15.633333333333333
functional area engineering design,15.622782031278348
program risk advise stakeholder,15.5
injection molding process,15.487179487179485
strong decision making skill,15.36111111111111
comprehensive mechanical engineering support,15.35704584040747
mechanical engineer diploma holders,15.21844280121792
amc vendor complete servicing,15.1875
plastic manufacturing process knowledge,15.12383338245407
quality check project executed,15.096459096459096
mechanical system hydraulics application,15.051913875598085
built drawing documentation reports,15.05065359477124
experience applying electro mechanical,14.945469686875416
engineering tool method standard,14.931899641577061
stations inverters transmission line,14.9
job production quality inspection,14.853492484526967
display panel internal equipment,14.814814814814813
heavy engineeringcompanies excellent control,14.793859649122808
daily work management mis,14.733333333333334
milk processing industry operation,14.670454545454545
ensure adequate inventory maintenance,14.606849315068493
good communication skill oral,14.587912087912088
detailed manufacturing drawing,14.504357298474945
vlite microprotol compress aspen,14.5
possess electro mechanical experience,14.445469686875416
company website ww sofomation,14.375
paint chemical petrochemical,14.333333333333332
time wastage entry analysis,14.31904761904762
diploma mechanical engg maintanace,14.24736842105263
job engineer mechanical static,14.243730157539758
ms windows environment,14.238095238095239
major equipment working principle,14.214814814814815
fire fighting standard,14.180555555555555
project execution completion control,14.118174223437382
solid work proficient person,14.033333333333333
data collection,14.0
electro mechanical requirement technology,13.996358320042532
sr site mechanical engineer,13.985109467884588
accurate record order equipment,13.981481481481481
3d cad tool,13.907051282051281
establish effective working relationship,13.9
pc mechanical engineer,13.818442801217921
written communication skill proficient,13.814102564102564
sc engg mechanical engineering,13.80704584040747
mechanical design calculation,13.733687318690427
mechanical engineer diploma freshers,13.71844280121792
design criteria calculations,13.698818897637796
ms word format,13.666666666666668
responsible engineer lead engineer,13.651672569854387
internationally recognized engineering qualification,13.584677419354838
place system machine,13.576340326340326
heat treatment furnace,13.533333333333333
role industrial engineer,13.454407713498622
ensure accident free execution,13.372727272727273
left wtp stp,13.333333333333332
mechanical maintenance engineer,13.325292116286414
maintenance engineer mechanical,13.325292116286413
electro mechanical system,13.301913875598085
mechanical design engineer,13.267261698855716
design engineer mechanical,13.267261698855716
experience testing development product,13.248101265822784
mechanical maint handling,13.210113519091847
man hour estimate preparation,13.2
supply chain activity,13.176470588235293
auto cad hvac,13.087606837606838
planning project management,13.084920634920636
getter result oriented person,13.0
location india development center,12.966666666666667
iv job specifications,12.925287356321839
3d software autocad,12.910714285714285
high standard,12.88888888888889
diploma mechanical engineers required,12.886257309941518
good interpersonal skill,12.857142857142858
preventive maintenance schedule adherence,12.847758405977583
corrective preventive action implementation,12.840909090909092
breakdown analysis sheet,12.827380952380953
engineering cad software,12.825062034739453
fresher mechanical engineer,12.818442801217921
mechanical design review,12.796187318690427
ensure energy conservation initiative,12.766666666666666
mechanical system machinery,12.718580542264752
plastic product design,12.709930008748906
meet desired quality standard,12.683760683760683
technical assignment involving,12.633333333333333
lead cross functional team,12.59120879120879
line experience including troubleshooting,12.581434599156118
statutory related document,12.547619047619047
manages scheduled condition monitoring,12.523809523809524
good communication skills,12.504578754578755
mechanical hydraulic pneumatic knowledge,12.502540834845734
plastic material hardware,12.501355013550135
assembly standardized component,12.5
implementing latest tqm technique,12.5
material selection properties,12.390243902439025
process control engineer,12.335446849800917
sr mechanical engineer,12.31844280121792
international marketing,12.3
finalizing equipment layout,12.281481481481482
complex skilled maintenance,12.256849315068493
power supply,12.181818181818182
handling overseas project,12.164332399626517
mechanical piping engineer,12.151776134551254
service engineer mechanical,12.06844280121792
mechanical safe system,12.051913875598085
good drawing reading,12.018907563025211
mechanical related design,12.01047303297614
plant equipment safety,12.000420875420875
fluent reading writing,12.0
prepare report maintain inventory,11.954822954822955
institute innovative design,11.848818897637795
prepare proposal drawing,11.834841628959277
graduate mechanical engineer,11.81844280121792
shift engineer mechanical,11.81844280121792
approving executive layout,11.8
review technical bids,11.8
perform design calculation,11.798083603520148
preventive maintenance activity,11.774228994212876
prepare design concept,11.771895820714718
engineering mechanical engineering,11.766723259762308
breakdown preventive maintenance,11.76442507264425
multi disciplinary team,11.76025641025641
projects planning sales,11.75
perform detailed design,11.749472492409037
high proficiency,11.666666666666668
software skills desired,11.666666666666668
process equipment maintenance,11.642176950396127
hydraulic system diagnostic,11.604545454545454
electro mechanical portion,11.597368421052632
utility plant maint,11.579545454545455
conduct design review,11.573818897637796
electrical mechanical engineers,11.569590643274854
diploma mechanical automobile,11.56555023923445
design mechanical part,11.523460045963153
technical analysis required,11.502380952380951
dispatch,11.5
pharmaceutical grade waxe,11.5
ms office product,11.483333333333334
heater package,11.428571428571429
design development modifying,11.365485564304462
manufacturing erp process,11.357549857549857
qualification degree diploma mechanical,11.35313765182186
assist marketing,11.35
execute detailed design,11.337707786526686
manpower management,11.3
mechanical design modification,11.296187318690427
good communications skills,11.273809523809526
piping isometric drawing,11.245098039215687
detail drawing bom,11.245098039215685
position status full time,11.233333333333333
maintenance engineering mechanicalelectrical,11.216526734423331
control plans meeting,11.210526315789473
analyze vendor offer,11.1875
supplier apqp ppap approval,11.166666666666666
engineering design installation,11.158496316992634
proactive mechanical maintenance,11.104217736121125
review problem solving,11.097826086956522
safrty reliability quality,11.086538461538462
correct manufacturing issue,11.078703703703702
optical mechanical engineering,11.05704584040747
project manager,11.034920634920635
equipment erection work,11.014814814814814
solid works experience,11.014767932489452
ordinate maintenance effort,11.006849315068493
poorly performing equipment,10.981481481481481
validate equipment design,10.930300379119277
vendor management,10.8875
multiple project simultaneously,10.834920634920636
routing basic mechanicalassembly,10.833333333333334
cost effective manner,10.833333333333334
plasma research,10.833333333333334
contracted personnel including,10.833333333333334
strong technical skill,10.827777777777778
engineer projects mechanical,10.81844280121792
mechanical engineer projects,10.81844280121792
maintaining mechanical utility,10.801913875598085
location chinchwad pune,10.8
tech robotic systemz,10.8
daily work management,10.733333333333334
erection testing commissioning,10.666666666666666
hvac water,10.625
good communication skill,10.587912087912088
cad designer engineer,10.586458995549904
mechanical equipment facility,10.578849902534113
fabrication drawing,10.57843137254902
mechanical engineers 0 3yrs,10.569590643274854
ensure process plant,10.54551282051282
work closely,10.533333333333333
resolve technical issue,10.508333333333333
cooling system,10.504545454545454
microprotol compress aspen,10.5
national oil company,10.5
sr fm electrical,10.5
complete electrical component,10.5
optical mechanical product,10.49736842105263
grasp processing technology,10.444444444444445
automobile engg department,10.429292929292929
job involves traveling,10.425287356321839
approve material substitution,10.390243902439025
sheet metal,10.375
design criterion required,10.365485564304462
adopting process engineering,10.363523573200991
problem solving skill,10.347826086956522
supports production activity,10.343137254901961
ms office essential 9,10.333333333333334
excellent communication skill,10.314102564102564
detail drawing creation,10.245098039215685
